{
  "$schema": "https://json-schema.org/draft/2020-12/schema",
  "$id": "https://knossos.local/schemas/project-config-v1.schema.json",
  "title": "Knossos project configuration v1",
  "type": "object",
  "additionalProperties": false,
  "required": ["version"],
  "properties": {
    "$schema": { "type": "string" },
    "version": { "const": 1 },
    "ignores": {
      "type": "array",
      "maxItems": 100,
      "uniqueItems": true,
      "items": { "type": "string", "minLength": 1 }
    },
    "limits": {
      "type": "object",
      "additionalProperties": false,
      "properties": {
        "max_files": { "type": "integer", "minimum": 1, "maximum": 100000 },
        "max_file_bytes": {
          "type": "integer",
          "minimum": 1,
          "maximum": 100000000
        },
        "worker_timeout_ms": {
          "type": "integer",
          "minimum": 1000,
          "maximum": 120000
        },
        "worker_memory_mb": {
          "type": "integer",
          "minimum": 64,
          "maximum": 65536
        },
        "watch_scan_timeout_ms": {
          "type": "integer",
          "minimum": 10000,
          "maximum": 3600000
        },
        "refresh_budget_ms": {
          "type": "integer",
          "minimum": 0,
          "maximum": 600000
        }
      }
    },
    "boundaries": {
      "type": "array",
      "maxItems": 50,
      "items": {
        "type": "object",
        "additionalProperties": false,
        "required": ["name"],
        "properties": {
          "name": {
            "type": "string",
            "minLength": 1,
            "not": { "enum": ["@unassigned", "@external"] }
          },
          "path_prefix": { "type": "string" },
          "namespace_prefix": { "type": "string" }
        },
        "anyOf": [
          { "required": ["path_prefix"] },
          { "required": ["namespace_prefix"] }
        ]
      }
    },
    "frameworks": {
      "type": "array",
      "maxItems": 20,
      "uniqueItems": true,
      "items": {
        "enum": [
          "laravel",
          "symfony",
          "django",
          "fastapi",
          "flask",
          "nextjs",
          "nestjs",
          "react",
          "vue",
          "axum",
          "actix",
          "rocket"
        ]
      }
    },
    "snapshot_retention": { "type": "integer", "minimum": 0, "maximum": 20 },
    "policies": {
      "type": "array",
      "maxItems": 50,
      "items": {
        "type": "object",
        "additionalProperties": false,
        "required": ["id", "from_boundary"],
        "properties": {
          "id": { "type": "string", "minLength": 1 },
          "from_boundary": { "type": "string", "minLength": 1 },
          "allow_targets": {
            "type": "array",
            "items": { "type": "string", "minLength": 1 }
          },
          "deny_targets": {
            "type": "array",
            "items": { "type": "string", "minLength": 1 }
          },
          "edge_kinds": {
            "type": "array",
            "items": { "type": "string", "minLength": 1 }
          }
        },
        "anyOf": [
          { "required": ["allow_targets"] },
          { "required": ["deny_targets"] }
        ]
      }
    },
    "quality_budgets": {
      "type": "object",
      "additionalProperties": false,
      "properties": {
        "new_cycles": { "type": "integer", "minimum": 0, "maximum": 100000 },
        "boundary_violations": {
          "type": "integer",
          "minimum": 0,
          "maximum": 100000
        },
        "error_diagnostics": {
          "type": "integer",
          "minimum": 0,
          "maximum": 100000
        },
        "warning_diagnostics": {
          "type": "integer",
          "minimum": 0,
          "maximum": 100000
        },
        "hub_degree_growth": {
          "type": "integer",
          "minimum": 0,
          "maximum": 100000
        },
        "unreferenced_candidates": {
          "type": "integer",
          "minimum": 0,
          "maximum": 100000
        },
        "public_surface_changes": {
          "type": "integer",
          "minimum": 0,
          "maximum": 100000
        }
      }
    },
    "dead_code_suppressions": {
      "type": "array",
      "maxItems": 200,
      "items": { "type": "string", "minLength": 1 },
      "description": "Canonical names (exact, or prefix with a trailing *) never to report as dead-code candidates."
    },
    "enrichers": {
      "type": "array",
      "maxItems": 32,
      "uniqueItems": true,
      "items": { "type": "string", "pattern": "^[a-z][a-z0-9_-]{0,63}$" },
      "description": "Names of enrichers the installation defines in enrichers.json, whose facts this project wants merged into its graph. A name only: the project never carries a command."
    },
    "web_roots": {
      "type": "object",
      "maxProperties": 50,
      "propertyNames": { "type": "string", "pattern": "^/(.*/)?$" },
      "additionalProperties": {
        "type": "string",
        "pattern": "^(?!.*\u0000)(?!/)(?![A-Za-z]:)(?!(.*[/\\\\])?\\.\\.([/\\\\]|$)).+/$"
      },
      "description": "URL path prefixes a web server maps to project folders, such as {\"/static/\": \"web/public/\"}. A root-absolute script URL in an HTML page that starts with a prefix resolves under that folder, the longest prefix first, and is reported when no scanned file is there. Keys start and end with /; folders are project-relative and end with /. Since 0.33.0."
    }
  }
}
